user_id,text,rating,time
1,"Прекрасная пицца! Тесто нежное, начинка разнообразная и свежая. Обслуживание на высоте, всегда радует посещать.",9,CURRENT_TIMESTAMP
2,"Их пицца просто восхитительна! Замечательное сочетание ингредиентов, внимание к деталям и быстрая доставка. Мы постоянные клиенты!",10,CURRENT_TIMESTAMP
3,"Уютное место с отличными пиццами. Понравился выбор начинок и качество теста. Обязательно рекомендую для семейных посиделок.",8,CURRENT_TIMESTAMP
4,"Пиццерия с атмосферой! Вежливый персонал, великолепные вкусы пиццы и широкий выбор блюд. Всегда радует визитом.",10,CURRENT_TIMESTAMP
5,"Всегда радует их пицца! Очень вкусные сочетания начинок, порции удовлетворительные. Обслуживание оперативное и дружелюбное.",9,CURRENT_TIMESTAMP